----------------------------------------------------------------------------
CrystalDiskInfo 8.17.5 (C) 2008-2022 hiyohiyo
                                Crystal Dew World: https://crystalmark.info/
----------------------------------------------------------------------------

    OS : Windows 11 Professional [10.0 Build 22621] (x64)
  Date : 2023/03/26 18:19:09

-- Controller Map ----------------------------------------------------------
 - Стандартный контроллер SATA AHCI [ATA]
 - Контроллер дискового пространства (Майкрософт) [SCSI]
 + Стандартный контроллер NVM Express [SCSI]
   - KINGSTON SNVS2000G
 - Xvdd SCSI Miniport [SCSI]

-- Disk List ---------------------------------------------------------------
 (01) KINGSTON SNVS2000G : 2000,3 GB [0/1/0, sq] - nv

----------------------------------------------------------------------------
 (01) KINGSTON SNVS2000G
----------------------------------------------------------------------------
           Model : KINGSTON SNVS2000G
        Firmware : S8442105
   Serial Number : 50026B7784D2BE67
       Disk Size : 2000,3 GB
       Interface : NVM Express
        Standard : NVM Express 1.3
   Transfer Mode : PCIe 3.0 x4 | PCIe 3.0 x4
  Power On Hours : 281 hours
  Power On Count : 57 count
      Host Reads : 4804 GB
     Host Writes : 2922 GB
     Temperature : 43 C (109 F)
   Health Status : Good (100 %)
        Features : S.M.A.R.T., TRIM, VolatileWriteCache
    Drive Letter : C: D:

-- S.M.A.R.T. --------------------------------------------------------------
ID RawValues(6) Attribute Name
01 000000000000 Critical Warning
02 00000000013C Composite Temperature
03 000000000064 Available Spare
04 00000000000A Available Spare Threshold
05 000000000000 Percentage Used
06 00000099BF69 Data Units Read
07 0000005D8216 Data Units Written
08 000003CAA2D2 Host Read Commands
09 00000297A3FC Host Write Commands
0A 000000001317 Controller Busy Time
0B 000000000039 Power Cycles
0C 000000000119 Power On Hours
0D 00000000000D Unsafe Shutdowns
0E 000000000000 Media and Data Integrity Errors
0F 000000000000 Number of Error Information Log Entries

-- IDENTIFY_DEVICE ---------------------------------------------------------
        0    1    2    3    4    5    6    7    8    9
000: 2646 2646 3035 3230 4236 3737 3438 3244 4542 3736
010: 2020 2020 494B 474E 5453 4E4F 5320 564E 3253 3030
020: 4730 2020 2020 2020 2020 2020 2020 2020 2020 2020
030: 2020 2020 3853 3434 3132 3530 B701 0026 0600 0001
040: 0300 0001 49F0 0002 3880 0001 0200 0000 0000 0000
050: 0000 0000 0000 0000 0000 0000 0000 0000 0000 0000
060: 0000 0000 0000 0000 0000 0000 0000 0000 0000 0000
070: 0000 0000 0000 0000 0000 0000 0000 0000 0000 0000
080: 0000 0000 0000 0000 0000 0000 0000 0000 0000 0000
090: 0000 0000 0000 0000 0000 0000 0000 0000 0000 0000
100: 0000 0000 0000 0000 0000 0000 0000 0000 0000 0000
110: 0000 0000 0000 0000 0000 0000 0000 0000 0000 0000
120: 0000 0000 0000 0000 0000 0000 0000 0000 0016 0700
130: 0312 043F 0101 0166 016B 0064 4000 0000 4000 0000
140: 0000 0000 0000 0000 0000 0000 0000 0000 0000 0000
150: 0000 0000 0000 0000 0000 0000 0000 0000 000A 0401
160: 0000 0001 0111 017A 0002 0000 0000 0000 0000 0000
170: 0000 0000 0000 0000 0000 0000 0000 0000 0000 0000
180: 0000 0000 0000 0000 0000 0000 0000 0000 0000 0000
190: 0000 0000 0000 0000 0000 0000 0000 0000 0000 0000
200: 0000 0000 0000 0000 0000 0000 0000 0000 0000 0000
210: 0000 0000 0000 0000 0000 0000 0000 0000 0000 0000
220: 0000 0000 0000 0000 0000 0000 0000 0000 0000 0000
230: 0000 0000 0000 0000 0000 0000 0000 0000 0000 0000
240: 0000 0000 0000 0000 0000 0000 0000 0000 0000 0000
250: 0000 0000 0000 0000 0000 0000

-- SMART_NVME --------------------------------------------------------------
     +0 +1 +2 +3 +4 +5 +6 +7 +8 +9 +A +B +C +D +E +F
000: 00 3C 01 64 0A 00 00 00 00 00 00 00 00 00 00 00
010: 00 00 00 00 00 00 00 00 00 00 00 00 00 00 00 00
020: 69 BF 99 00 00 00 00 00 00 00 00 00 00 00 00 00
030: 16 82 5D 00 00 00 00 00 00 00 00 00 00 00 00 00
040: D3 A2 CA 03 00 00 00 00 00 00 00 00 00 00 00 00
050: FC A3 97 02 00 00 00 00 00 00 00 00 00 00 00 00
060: 17 13 00 00 00 00 00 00 00 00 00 00 00 00 00 00
070: 39 00 00 00 00 00 00 00 00 00 00 00 00 00 00 00
080: 19 01 00 00 00 00 00 00 00 00 00 00 00 00 00 00
090: 0D 00 00 00 00 00 00 00 00 00 00 00 00 00 00 00
0A0: 00 00 00 00 00 00 00 00 00 00 00 00 00 00 00 00
0B0: 00 00 00 00 00 00 00 00 00 00 00 00 00 00 00 00
0C0: 00 00 00 00 00 00 00 00 00 00 00 00 00 00 00 00
0D0: 00 00 00 00 00 00 00 00 00 00 00 00 00 00 00 00
0E0: 00 00 00 00 00 00 00 00 00 00 00 00 00 00 00 00
0F0: 00 00 00 00 00 00 00 00 00 00 00 00 00 00 00 00
100: 00 00 00 00 00 00 00 00 00 00 00 00 00 00 00 00
110: 00 00 00 00 00 00 00 00 00 00 00 00 00 00 00 00
120: 00 00 00 00 00 00 00 00 00 00 00 00 00 00 00 00
130: 00 00 00 00 00 00 00 00 00 00 00 00 00 00 00 00
140: 00 00 00 00 00 00 00 00 00 00 00 00 00 00 00 00
150: 00 00 00 00 00 00 00 00 00 00 00 00 00 00 00 00
160: 00 00 00 00 00 00 00 00 00 00 00 00 00 00 00 00
170: 00 00 00 00 00 00 00 00 00 00 00 00 00 00 00 00
180: 00 00 00 00 00 00 00 00 00 00 00 00 00 00 00 00
190: 00 00 00 00 00 00 00 00 00 00 00 00 00 00 00 00
1A0: 00 00 00 00 00 00 00 00 00 00 00 00 00 00 00 00
1B0: 00 00 00 00 00 00 00 00 00 00 00 00 00 00 00 00
1C0: 00 00 00 00 00 00 00 00 00 00 00 00 00 00 00 00
1D0: 00 00 00 00 00 00 00 00 00 00 00 00 00 00 00 00
1E0: 00 00 00 00 00 00 00 00 00 00 00 00 00 00 00 00
1F0: 00 00 00 00 00 00 00 00 00 00 00 00 00 00 00 00

